Organization Name,Organization Name URL,Categories,Headquarters Location,Description,CB Rank (Company)
GradeSlam,https://www.crunchbase.com/organization/gradeslam,"EdTech, Education, Tutoring","Montréal, Quebec, Canada",Powering Personalized Learning In Schools & Districts,"20,460"
Google Cloud Platform,https://www.crunchbase.com/organization/google-cloud-platform,"Cloud Computing, Cloud Data Services, Developer Platform","San Francisco, California, United States",Google Cloud Platform is a tool suite for app developers.,"20,494"
Gold Bits Coin,https://www.crunchbase.com/organization/gold-bits-coin,"Blockchain, Cryptocurrency, Finance, Internet","South Melbourne, Victoria, Australia",Gold Bits coin is a trending Crypto with Real Gold Backing.,"20,498"
Gecko Robotics,https://www.crunchbase.com/organization/gecko-robotics,"Industrial, Robotics","Pittsburgh, Pennsylvania, United States",Gecko Robotics develops and operates robots to perform infrastructure inspections by climbing into confined and dangerous places.,"20,500"
Gi Fly,https://www.crunchbase.com/organization/bignay-inc,"Electric Vehicle, Hardware, Mobile, Software","New York, New York, United States",Bignay Inc. combines software and hardware to solve issues within urban areas.,"20,507"
Gremlin Social,https://www.crunchbase.com/organization/gremln,"Apps, Financial Services, Social Media, Software","St Louis, Missouri, United States",Gremln provides social media marketing and compliance tools for banks and financial services companies.,"20,512"
GlassIG,https://www.crunchbase.com/organization/glassig,Small and Medium Businesses,"Geneva, Geneve, Switzerland",GlassIG is an independent software vendor. Our aim is to provide market leading.,"20,519"
GUTS Tickets,https://www.crunchbase.com/organization/guts-tickets,Ticketing,"Amsterdam, Noord-Holland, The Netherlands", A ticketing platform powered by blockchain that facilitates the issuance of smart tickets to fight ticket touts. ,"20,553"
Gobbler,https://www.crunchbase.com/organization/gobbler,"Cloud Computing, Digital Media, Enterprise Software","Los Angeles, California, United States","Gobbler is a backup, transfer, and organizational tool for managing users' media project files and assets.","20,564"
GoQuo,https://www.crunchbase.com/organization/goquo,"E-Commerce, Information Technology, Travel","Kuala Lumpur, Kuala Lumpur, Malaysia",Increasing Airline Ancillary Revenues,"20,591"
G:loot,https://www.crunchbase.com/organization/gumbler,PC Games,"Stockholm, Stockholms Lan, Sweden",Gumbler is a unique Esports platform that lets gamers of mobile,"20,601"
"Gbox by OnCircle, Inc.",https://www.crunchbase.com/organization/oncircle-inc,"Payments, Sports, Video on Demand, Video Streaming, Virtual Reality","Mountain View, California, United States",Direct-to-consumer multimedia monetization.,"20,629"
Glam Studios,https://www.crunchbase.com/organization/glamstudios-in,Internet,"Noida, Uttar Pradesh, India",Glam Studios is India’s first chain of technology-driven and quality-conscious salons to suit realistic budgets of our customers.,"20,642"
"Gemr, Inc.",https://www.crunchbase.com/organization/gemr,"Apps, Collectibles, Marketplace, Social Media","Nashua, New Hampshire, United States",Gemr is an online community and marketplace for people who are passionate about collecting.,"20,664"
Galena Biopharma,https://www.crunchbase.com/organization/galena-biopharma,"Biotechnology, Health Diagnostics, Medical","Portland, Oregon, United States","Galena Biopharma, Inc. (Nasdaq: GALE) is focused on discovering, developing and commercializing innovative therapies.","20,682"
Gavelytics,https://www.crunchbase.com/organization/gavelytics,Legal,"Santa Monica, California, United States",Gavelytics is a California-based judicial analytics company.,"20,684"
GolfLAN,https://www.crunchbase.com/organization/golflan,"Communities, Sporting Goods, Sports","New Delhi, Delhi, India",Golflan Technologies is a Delhi-based company,"20,697"
Goal Zero,https://www.crunchbase.com/organization/goal-zero,"Consumer Goods, Energy, Software, Solar","Salt Lake City, Utah, United States","Goal Zero develops portable solar power systems, including solar panels, portable power packs, generators, chargers and accessories.","20,717"
Genially,https://www.crunchbase.com/organization/genially,"Content, Digital Media, Graphic Design, Presentations, Social Media, Software","Córdoba, Andalucia, Spain",Genially is a tool aimed to create interactive and animated content that can be used to enrich websites & blogs or as a communication tool.,"20,719"
Gemio,https://www.crunchbase.com/organization/gemio,"Hardware, Internet of Things, SaaS, Software, Wearables","Seattle, Washington, United States","Gemio is a new IoT-based fan engagement platform that connects people and their passions (i.e music, sports) in a powerful new way. ","20,723"
Gooster,https://www.crunchbase.com/organization/gooster,Travel,"Tel Aviv, Tel Aviv, Israel","The A.I. concierge chatbot, helping urban hotels rediscover their guests, while they discover the city, through messaging.","20,744"
Geospatial,https://www.crunchbase.com/organization/geospatial,"Enterprise Software, Infrastructure, Mapping Services","Sarver, Pennsylvania, United States","Geospatial Corporation is the leader in underground infrastructure location, mapping, and management.","20,778"
Geo Adventures Inc.,https://www.crunchbase.com/organization/geo-adventures-inc-,"Information Technology, Recruiting","Tokyo, Tokyo, Japan",We conduct the recruiting and import business form foreign countries to Japan. Our mission is to encourage Japanese society.,"20,792"
Genetron Health,https://www.crunchbase.com/organization/genetron-health,Health Care,,Cancer genomics solutions company .,"20,884"
GuestDriven,https://www.crunchbase.com/organization/guestdriven,"Hospitality, Mobile, Travel","Montréal, Quebec, Canada",GuestDriven is a Mobile Guest Engagement platform that helps hotels build better guest relationships and earn more revenue.,"20,899"
Guggy,https://www.crunchbase.com/organization/guggy,"Internet, Media and Entertainment, Messaging","Tel Aviv-yafo, Tel Aviv, Israel","Guggy helps you make your friends laugh by turning your text messages into engaging content, such as personalized GIFs.","20,916"
Giga Watt,https://www.crunchbase.com/organization/giga-watt,Power Grid,"Washington, District of Columbia, United States",The world’s first state of the art combined Blockchain hosting and service center.,"20,968"
GIZTIX,https://www.crunchbase.com/organization/giztix,"Logistics, SaaS","Bangkok, Krung Thep, Thailand",GIZTIX is logistics marketplace where you can check transportation and freight prices online instantly.,"20,980"
Gfresh,https://www.crunchbase.com/organization/gfresh,"E-Commerce Platforms, Logistics, Seafood","Shanghai, Shanghai, China",Gfresh offers a seafood eCommerce platform with integrated cold chain logistics and inspection services.,"20,984"
GamersFirst,https://www.crunchbase.com/organization/gamersfirst,"MMO Games, Online Games, Publishing","Edinburgh, Edinburgh, City of, United Kingdom",GamersFirst is a global free2play publisher of multiplayer online games.,"20,994"
G-Banker,https://www.crunchbase.com/organization/g-banker,"FinTech, Internet, Online Auctions, Trading Platform","Chaoyang, Liaoning, China",Beijing-based gold trading O2O (online-to-offline) platform,"21,000"
Giraffe,https://www.crunchbase.com/organization/giraffe-2,"Analytics, Mobile Apps, Recruiting","Johannesburg, NA - South Africa, South Africa",Giraffe is a recruitment app.,"21,005"
Gilmour Space Technologies,https://www.crunchbase.com/organization/gilmour-space-technologies,"Aerospace, Industrial Engineering, Space Travel","Pimpama, Queensland, Australia",Gilmour Space Technologies is a new space rocket company that's developing low cost hybrid launch vehicles in Australia & Singapore.,"21,011"
Grand Circus,https://www.crunchbase.com/organization/grand-circus,"Coworking, EdTech, Education, Web Development","Detroit, Michigan, United States","Grand Circus is a training institute that provides customized training, coworking, and events for the tech community.","21,012"
gShift,https://www.crunchbase.com/organization/gshift-labs,"Analytics, Content Marketing, SaaS, Search Engine, SEO, Software","Barrie, Ontario, Canada","Enterprise SEO, Web presence analytics and content performance platform.","21,059"
General Compression,https://www.crunchbase.com/organization/general-compression,"CleanTech, Energy, Energy Storage","Newton, Massachusetts, United States","General Compression develops advanced compressed air energy storage technology that produces low-cost, dispatchable clean power.","21,088"
GT Advanced Technologies,https://www.crunchbase.com/organization/gt-advanced-technologies,"Advanced Materials, Consumer Electronics, Solar","Merrimack, New Hampshire, United States","GT Advanced Technologies offers innovative crystal growth equipment solutions for the solar, LED and consumer electronics industries.","21,089"
GasBuddy,https://www.crunchbase.com/organization/gasbuddy,"Crowdsourcing, Mobile, Oil and Gas, Travel","Boston, Massachusetts, United States","GasBuddy, the only smartphone app connecting drivers with their Perfect Pit Stop.","21,120"
GINKGOTREE,https://www.crunchbase.com/organization/ginkgotree,"Content, E-Learning, Education","Detroit, Michigan, United States",Ginkgotree is a course content platform for teachers and trainers to build online curriculums.,"21,143"
Ganymed Pharmaceuticals,https://www.crunchbase.com/organization/ganymed-pharmaceuticals,"Biopharma, Biotechnology, Pharmaceutical","Mainz, Rheinland-Pfalz, Germany",Ganymed Pharmaceuticals is a biopharmaceutical developing therapeutic drugs designed to kill tumor cells without harming healthy tissues.,"21,174"
Gliph,https://www.crunchbase.com/organization/gliph,"Apps, Messaging, Peer to Peer, Privacy, Security","San Mateo, California, United States",Gliph Marketplace saves buyers and sellers time and energy using a new peer-to-peer (P2P) transaction method called Deal Flow.,"21,195"
Geld-für-Flug,https://www.crunchbase.com/organization/geld-für-flug,"Consumer, Customer Service, Travel","Düsseldorf, Nordrhein-Westfalen, Germany",LegalTech,"21,253"
GraphPath,https://www.crunchbase.com/organization/graphpath,"Big Data, Information Services, Information Technology, Service Industry","Miami, Florida, United States",GraphPath helps enterprises to evolve from big data to big knowledge through the creation of large-scale enterprise knowledge graphs.,"21,264"
GrabOn,https://www.crunchbase.com/organization/grabon,"Coupons, E-Commerce, Shopping","Hyderabad, Andhra Pradesh, India","GrabOn is an online coupons, offers, promo codes, and coupon codes site.","21,265"
Getka Energy,https://www.crunchbase.com/organization/getka-energy,"Logistics, Oil and Gas","Tulsa, Oklahoma, United States",Crude oil logistics provider Company.,"21,303"
Glide Pharmaceutical Technologies,https://www.crunchbase.com/organization/glide-pharma,"Biotechnology, Health Care, Pharmaceutical","Abingdon, Oxfordshire, United Kingdom",Glide Pharma is a specialty pharmaceutical company developing products for the convenient delivery of biological medicines.,"21,308"
GaiaWorks,https://www.crunchbase.com/organization/gaiaworks,,"Jiangsu, China, Asia",GaiaWorks is a workforce management system developer.,"21,343"
good culture,https://www.crunchbase.com/organization/good-culture,Food and Beverage,"California City, California, United States","iTeam, a SaaP-based solution, streamlines the packaging and selling procedures attached to IT, and audio and video installation services.","21,357"
Grid4C,https://www.crunchbase.com/organization/grid4c,"Analytics, Power Grid, Predictive Analytics","Israel, Asia",Smart Grid Descriptive Analytics and Grid4C's Smart Grid Predictive Analytics,"21,390"
Genius,https://www.crunchbase.com/organization/genius-com,"Content, Digital Media, Internet, Music, Video","Brooklyn, New York, United States",Genius is the world's biggest encyclopedia of music reaching over 100 million people everywhere music fans connect across the internet.,"21,392"
Gophr,https://www.crunchbase.com/organization/gophr-limited,"B2B, Courier Service, Delivery, Delivery Service, E-Commerce, Information Technology, Logistics, Same Day Delivery","London, England, United Kingdom",Tech that connects professional same-day couriers to business customers.,"21,434"
Grenville Strategic Royalty Corp.,https://www.crunchbase.com/organization/grenville-strategic-royalty,"Finance, Industrial Automation, Information Services, Information Technology, SaaS, Small and Medium Businesses, Venture Capital","Toronto, Ontario, Canada",Grenville Strategic Royalty offers a royalty-based finance solution to small and medium-sized businesses in the USA and Canada.,"21,451"
GlossGenius,https://www.crunchbase.com/organization/glossgenuis,"Apps, Beauty, Mobile Apps, Small and Medium Businesses, Software, Wellness","New York, New York, United States","All-in-One Solution made for Beauty Professionals. Introducing better Scheduling, Client Management, & Marketing. Available on iOS & Android","21,455"
Goldfinch Biopharma,https://www.crunchbase.com/organization/goldfinch-biopharma,"Health Care, Medical Device, Therapeutics","Cambridge, Massachusetts, United States",Goldfinch is singularly focused on discovering and developing precision therapies for patients with kidney disease.,"21,469"
Graphext,https://www.crunchbase.com/organization/graphext,"Analytics, Artificial Intelligence, Business Intelligence, Data Visualization","Madrid, Madrid, Spain",Graphext is a smart data discovery software that empowers data lovers to develop and test their hypotheses rapidly without coding ,"21,493"
Get My Peon,https://www.crunchbase.com/organization/get-my-peon,Professional Services,"Mumbai, Maharashtra, India",Get My Peon is an innovative errand-running and same-day delivery service.,"21,522"
Gebni,https://www.crunchbase.com/organization/gebni,"E-Commerce, Food Delivery, Machine Learning, Mobile Apps, Software","New York, New York, United States","Gebni offers restaurant delivery and takeout at demand-adjusted prices to boost restaurants' sales, improve margins and save users money","21,534"
GoReact,https://www.crunchbase.com/organization/goreact,"Analytics, EdTech, SaaS, Software, Video","Orem, Utah, United States",GoReact is a SaaS video coaching and feedback system for educational and professional organizations.,"21,586"
Grabbr,https://www.crunchbase.com/organization/grabbr,"Internet, Publishing","Franklin, Tennessee, United States",Grabbr is a spoke in the wheel of marketing that simply hasn’t been done before.,"21,607"
Groupalia,https://www.crunchbase.com/organization/groupalia,"Price Comparison, Retail, Software","Barcelona, Catalonia, Spain","Groupalia, an e-commerce platform, offers discounted flash sales on leisure packages, services, food, and other products in Spain and Italy.","21,616"
GO Outdoors,https://www.crunchbase.com/organization/go-outdoors,"Adventure Travel, Customer Service, E-Commerce","Sheffield, Sheffield, United Kingdom","GO Outdoors is an outdoor store offering waterproof clothing, outdoor clothing, tents and camping equipment in the UK.","21,617"
Ghostruck,https://www.crunchbase.com/organization/ghostruck,"Logistics, Mobile","Seattle, Washington, United States",Ghostruck is a smartphone application that enables users to connect with professional movers.,"21,655"
Grand Cru,https://www.crunchbase.com/organization/grand-cru,"Gaming, Mobile Apps, Online Games","Helsinki, Southern Finland, Finland",Grand Cru develops mobile and social games supporting player interaction.,"21,690"
Gooroo,https://www.crunchbase.com/organization/ms-gooroo,"Analytics, Artificial Intelligence, Big Data, Collaboration, Human Resources, Machine Learning, Neuroscience, Recruiting, Training","Australia, Oceania","Gooroo is a predictive technology platform that makes hiring talent more accurate, teams more productive and communications more targeted. ","21,723"
Games Done Quick,https://www.crunchbase.com/organization/games-done-quick,"Gaming, Video Games, Video Streaming","Minneapolis, Minnesota, United States",Games Done Quick is a charity video game marathon.,"21,838"
Genability,https://www.crunchbase.com/organization/genability,"Energy Management, Information Technology, Renewable Energy","San Francisco, California, United States",Genability is a company that provides solutions to track and adjust energy usage and savings.,"21,848"
Gushcloud International ,https://www.crunchbase.com/organization/gushcloud,"Advertising, Internet, Mobile","Singapore, Central Region, Singapore",Gushcloud is an influencer marketing and talent agency network ,"21,851"
Glovebox Direct,https://www.crunchbase.com/organization/glovebox-direct,Retail,,Specialist automotive marketplace offering exclusively genuine original equipment direct from manufacturers,"21,859"
Glisser,https://www.crunchbase.com/organization/glisser,"Market Research, Presentations, Software","London, England, United Kingdom","Glisser provides interactive presentation software that pushes slides to audience devices and integrates voting, questions, and feedback.","21,872"
GoMechanic,https://www.crunchbase.com/organization/gomechanic,"Automotive, Customer Service, Manufacturing","Gurgaon, Haryana, India",GoMechanic is a Automobile servicing platform,"21,895"
GiftStarter,https://www.crunchbase.com/organization/giftstarter,"Collaborative Consumption, E-Commerce, FinTech","Seattle, Washington, United States","Afford better gifts together using our flexible partial payments platform, for anything online.","21,966"
"GRO Biosciences, Inc.",https://www.crunchbase.com/organization/gro-biosciences-inc,,"Boston, Massachusetts, United States",GRO Biosciences transforms protein therapeutics with new amino acid building blocks to treat incurable diseases.,"22,071"
GroSocial,https://www.crunchbase.com/organization/grosocial,"Enterprise Software, Social Media Marketing, Web Browsers","Orem, Utah, United States",GroSocial is a web-based social media marketing software tools platform enabling users to build and track their Facebook and Twitter pages.,"22,104"
Gigi Hill,https://www.crunchbase.com/organization/gigi-hill,"Lifestyle, Manufacturing, Product Design","Yorba Linda, California, United States",Gigi Hill is a direct sales company that designs and manufactures handbags and totes.,"22,246"
Graymatics,https://www.crunchbase.com/organization/graymatics,"Advertising, Image Recognition","Singapore, Central Region, Singapore","Graymatics, a cloud platform, provides digital video and image recognition technology to products within images or video content.","22,248"
GiveMeSport,https://www.crunchbase.com/organization/givemesport,"Digital Media, Publishing, Sports","London, England, United Kingdom",GiveMeSport is a print-based sports publication which celebrates athleticism in all its diverse forms.,"22,287"
GeoOptics,https://www.crunchbase.com/organization/geooptics,"Data Integration, Environmental Consulting, Geospatial, Information Services","Pasadena, California, United States","Geooptics, an environmental data company, carries out daily weather forecasting and environmental monitoring and research activities.","22,346"
Graphika,https://www.crunchbase.com/organization/graphika-inc-,"Content, Marketing, Social Media, Text Analytics","New York, New York, United States","Graphika identifies social communities and influencers within them, mapping spheres of influence on topics & content you care about most.","22,380"
Gainful,https://www.crunchbase.com/organization/gainful,"Dietary Supplements, Personal Health, Wellness","San Mateo, California, United States","Personalized protein powder, delivered directly to your doorstep.","22,389"
Greentech Media,https://www.crunchbase.com/organization/greentech-media,"Digital Media, Energy Efficiency, Solar","Boston, Massachusetts, United States","Greentech Media is an online media company providing news, in-depth market research and analysis on the greentech B2B market.","22,405"
Geopointe,https://www.crunchbase.com/organization/geopointe,"Enterprise, Location Based Services, Mapping Services","Irvine, California, United States",Geopointe location-enables Salesforce allowing Customers to gain spatial insights via maps and apply geography to business processes.,"22,455"
Galectin Therapeutics,https://www.crunchbase.com/organization/pro-pharmaceuticals,Biotechnology,"Norcross, Georgia, United States",Galectin Therapeutics uses galectin science and drug development to create new therapies for fibrotic diseases and cancer.,"22,477"
Granite Properties,https://www.crunchbase.com/organization/granite-properties,"Commercial Real Estate, Property Development, Real Estate","Plano, Texas, United States","Granite Properties is a privately held commercial real estate investment and management company with offices in Atlanta, Dallas, Denver,","22,506"
Gimv,https://www.crunchbase.com/organization/gimv,"Finance, Financial Services, Venture Capital","Antwerpen, Antwerpen, Belgium","Gimv is a European private equity firm that invests in selected investment platforms with a focus on Benelux, France, and Germany.","22,513"
Garajyeri,https://www.crunchbase.com/organization/garajyeri,"Automotive, Car Sharing, Peer to Peer, Sharing Economy, Transportation","Istanbul, Istanbul, Turkey",First and only P2P(peer to peer) car sharing network in Turkey,"22,520"
Grow Mobile,https://www.crunchbase.com/organization/grow-mobile,"Ad Network, App Marketing, Apps, Mobile","San Francisco, California, United States","Grow Mobile provides a single, mobile ad buying platform for marketers to buy, track and optimize mobile app promotions.","22,555"
GreenVolts,https://www.crunchbase.com/organization/greenvolts,"Energy, Renewable Energy, Solar","Fremont, California, United States",GreenVolts is a solar startup that enables low cost power production.,"22,623"
GCI Com,https://www.crunchbase.com/organization/gci-com,"Enterprise Software, Service Industry, Software","Lincoln, Lincolnshire, United Kingdom",GCI Telecom is a UK-based independent telecoms and data services company delivering cloud hosting and managed-cloud-solutions.,"22,658"
Ghinwa ,https://www.crunchbase.com/organization/ghinwa,"Music, Music Education","Dubai, Dubai, United Arab Emirates",A mobile app for anonymous self-broadcasting and Karaoke.,"22,669"
Grub Club,https://www.crunchbase.com/organization/grub-club,"Collaborative Consumption, Hospitality, Internet, Restaurants, Travel","London, England, United Kingdom",Top Table for Pop Up Restaurants. Dining Out just got Fun!,"22,677"
GovInvest,https://www.crunchbase.com/organization/govinvest,GovTech,"Torrance, California, United States",GovInvest helps governments visualize and understand complex actuarial data.,"22,691"
GoBumpr,https://www.crunchbase.com/organization/gobumpr,"Automotive, E-Commerce, Mobile","Mylapore, Tamil Nadu, India",Car Service and Bike Service Mobile App,"22,753"
GetSet,https://www.crunchbase.com/organization/getset,"EdTech, Education","Chicago, Illinois, United States","GetSet, a new stealthy US edtech startup that’s aiming to reduce the high college drop-out rate","22,754"
GLI Finance,https://www.crunchbase.com/organization/gli-finance-ltd,"Enterprise Software, Finance, Small and Medium Businesses","St. Peter Port, NA - Guernsey, Guernsey",GLI Finance is a small & medium enterprise alternative finance.,"22,772"
Gallop.ai,https://www.crunchbase.com/organization/trafla,"Artificial Intelligence, Business Travel, Travel","Mclean, Virginia, United States",Gallop makes booking your business travel a breeze.,"22,803"
GUIDEBOAT,https://www.crunchbase.com/organization/guideboat,"E-Commerce, Lifestyle, Men's","Mill Valley, California, United States","Guideboat offers a range of boats and related tools, apparel, gear, and accessories for both men and women.","22,829"
Grasshopper Solar,https://www.crunchbase.com/organization/grasshopper-solar,Renewable Energy,"Mississauga, Ontario, Canada",Their vision is to transform the way we use resources by providing access to sustainable solutions.,"22,890"
Gfinity,https://www.crunchbase.com/organization/gfinity,eSports,"London, England, United Kingdom",Gfinity is focused on promoting the development of the e-sports scene in the United Kingdom.,"22,973"
Graphite Software,https://www.crunchbase.com/organization/graphite-software,"App Marketing, Cyber Security, Enterprise Software, File Sharing, Mobile, Security, Software","Sunnyvale, California, United States",Graphite Software is a consumer privacy solutions provider software company.,"22,979"
Gowalla,https://www.crunchbase.com/organization/gowalla,"Location Based Services, Photography, Private Social Networking, Travel","Austin, Texas, United States","Gowalla is a social guide for its users to share and discover photos, experiences and recommendations of places and cities.","23,022"
Gravity Blanket,https://www.crunchbase.com/organization/gravity-blanket,,"Tel Aviv, Tel Aviv, Israel",Gravity Blanket is a weighted blanket engineered to naturally reduce stress and increase relaxation.,"23,062"
gurucargo.com,https://www.crunchbase.com/organization/gurucargo-com,"Internet, Logistics, Shipping","Montevideo, NA - Uruguay, Uruguay",One stop shop technology platform for cargo shipping,"23,066"
Glance Tech,https://www.crunchbase.com/organization/glance-clock,"Artificial Intelligence, Hardware, Internet of Things, Software","Palo Alto, California, United States",Glance Tech makes any information glanceable. Glance Clock is the first product with a glanceable interface and AI engine on the cloud.,"23,080"
Givesurance,https://www.crunchbase.com/organization/givesurance,"Charity, Insurance","Woodland Hills, California, United States",Helps people support the charities that matter to them by leveraging their choice of insurance provider.,"23,089"
