Organization Name,Organization Name URL,Categories,Headquarters Location,Description,CB Rank (Company)
Guidebook,https://www.crunchbase.com/organization/guidebook,"Internet, Mobile, SaaS","San Francisco, California, United States",Guidebook is a simple yet powerful mobile application builder that lets you create an app with no technical skills required.,"6,066"
Glide.org,https://www.crunchbase.com/organization/glide-org,Communities,"San Francisco, California, United States","GLIDE is to create a radically inclusive, just and loving community mobilized to alleviate suffering.","6,068"
Gymlib.com,https://www.crunchbase.com/organization/gymlib-com,Gaming,"Neuilly-sur-seine, Ile-de-France, France","Gymlib.com is a French startup that offers quicker, more convenient access to fitness spaces.","6,083"
GoodRx,https://www.crunchbase.com/organization/goodrx,"Health Care, Medical, Pharmaceutical","Santa Monica, California, United States",GoodRx believes prescription drugs should be affordable and convenient for everyone.,"6,137"
GeoSpock Ltd.,https://www.crunchbase.com/organization/geospock-ltd-,"Database, Geospatial, Information Services, Real Time, SaaS","Cambridge, Cambridgeshire, United Kingdom","GeoSpock is a high-tech company focused on building a scalable, real-time geospatial database to power the next wave of applications.","6,164"
GAIA,https://www.crunchbase.com/organization/gaia-design,"Consumer Goods, E-Commerce, Furniture, Internet, Retail","Mexico City, Distrito Federal, Mexico",Digitally native vertical furniture brand in Mexico,"6,180"
GreatHorn,https://www.crunchbase.com/organization/greathorn,"Cyber Security, Hardware, Internet, Machine Learning","Belmont, Massachusetts, United States","GreatHorn is a cybersecurity solution for cloud communication infrastructure, including email, collaboration, and chat tools.","6,290"
GLXSS,https://www.crunchbase.com/organization/glxss,"Augmented Reality, Enterprise, Virtual Reality","Beijing, Beijing, China","GLXSS is the creator of GLXSS Smart Glasses, which bring augmented reality to the security, medical, and manufacturing industries.","6,295"
Global-e,https://www.crunchbase.com/organization/global-e,"Delivery, E-Commerce, Internet, Logistics, Retail","London, England, United Kingdom",Global-e is a provider of comprehensive cross-border e-commerce solutions.,"6,314"
GoHealth,https://www.crunchbase.com/organization/gohealth,"Health Care, Health Insurance, Insurance, Software","Chicago, Illinois, United States","GoHealth is an online portal for finding health insurance coverage, allowing users to compare health insurance quotes and purchase online.","6,327"
Getable,https://www.crunchbase.com/organization/getable,"Construction, E-Commerce, Marketplace, Mobile","San Francisco, California, United States",Getable serves the construction rental market with mobile tools designed for construction professionals and rental equipment providers.,"6,334"
Guatemala.com,https://www.crunchbase.com/organization/smetrica,"Facebook, Social Media, Web Apps",,"Smetrica is a web application for Facebook metrics that offers extracting data such as number of fans, people talking about, and posts.","6,351"
GHL Systems Berhad,https://www.crunchbase.com/organization/ghl-systems-berhad,"Financial Services, Payments, Point of Sale","Kuala Lumpur, Kuala Lumpur, Malaysia",GHL Systems Berhad is a payment service provider.,"6,363"
Genapsys Inc.,https://www.crunchbase.com/organization/genapsys,"Biotechnology, Genetics, Health Diagnostics","Redwood City, California, United States",GenapSys has developed a novel DNA sequencing technology and detection system for applied genomic testing and medical sequencing.,"6,437"
Greenfly,https://www.crunchbase.com/organization/greenfly-2,"Content Creators, Digital Media, Video","Santa Monica, California, United States","Greenfly's technology platform transforms an organizations existing relationship network into a new, powerful source for content.","6,440"
GlampingHub.com,https://www.crunchbase.com/organization/glampinghub-com,"Hospitality, Sustainability, Tourism, Travel","San Francisco, California, United States",Glamping is a global phenomenon. Our team has found original destinations with incredible accommodations all over the globe. Everything,"6,478"
Generation Bio,https://www.crunchbase.com/organization/generation-bio,"Biotechnology, Genetics, Health Care","Cambridge, Massachusetts, United States",Generation Bio is developing a breakthrough class of genetic medicines based on its proprietary GeneWave technology,"6,484"
Geru,https://www.crunchbase.com/organization/geru,"Consumer Lending, Credit, Finance, FinTech, Personal Finance","São Paulo, Sao Paulo, Brazil","Geru is a simple, fast, fair and cost-effective online loan platform that connects borrowers and investors.","6,500"
Global Savings Group,https://www.crunchbase.com/organization/global-savings-group,"Affiliate Marketing, Content Discovery, Coupons, E-Commerce, Service Industry, Travel","Munich, Bayern, Germany",A leading Commerce Content platform operating 100+ digital portals and tools connecting commerce to content.,"6,522"
gyft ,https://www.crunchbase.com/organization/gyft,"Gift Card, Internet, Mobile, Mobile Payments","Mountain View, California, United States","gyft is a mobile gift card app that allows customers to buy, store, send and redeem gift cards conveniently from their mobile device.","6,587"
GaN Systems,https://www.crunchbase.com/organization/gan-systems,"Electronics, Energy, Semiconductor","Toronto, Ontario, Canada",GaN Systems offers a range of Gallium Nitride high power switching diodes and transistors for clean tech power conversion applications.,"6,647"
GLO,https://www.crunchbase.com/organization/glo,"Manufacturing, Nanotechnology","Sweden, Europe",GLO is focused on the development and commercialization of advanced LED products using nanotechnology.,"6,679"
Growlabs,https://www.crunchbase.com/organization/growlabs,"Lead Generation, Sales Automation, Software","San Francisco, California, United States",Growlabs is an all-in-one marketing and sales automation platform.,"6,712"
Game Closure,https://www.crunchbase.com/organization/game-closure,"Gaming, Software, Web Development","Mountain View, California, United States","Game Closure develops multiplayer gaming technology that helps compile, accelerate and deploy games.","6,723"
GLOSSYBOX,https://www.crunchbase.com/organization/glossybox,"Beauty, Communities, E-Commerce","Berlin, Berlin, Germany","GLOSSYBOX is an online subscription service, delivering high-end beauty products directly to its users’ doorstep.","6,756"
Greenlots,https://www.crunchbase.com/organization/greenlots,"Automotive, Electric Vehicle, Software","Los Angeles, California, United States",We're unlocking the possibilities of the electric mobility future by delivering innovative EV charging software and solutions.,"6,777"
Gauss Surgical,https://www.crunchbase.com/organization/gauss-surgical,"Biotechnology, Medical, Medical Device, Mobile","Los Altos, California, United States","Gauss Surgical, a med tech company, develops a mobile vision-based platform for accurate and real-time measurement of surgical blood loss.","6,833"
GrowGeneration,https://www.crunchbase.com/organization/growgeneration,"E-Commerce, Hydroponics, Retail, Shopping","Pueblo, Colorado, United States",GrowGeneration is a network of hydroponic retail stores that provide indoor and outdoor gardeners with personalized shopping experiences.,"6,885"
Global Blood Therapeutics,https://www.crunchbase.com/organization/global-blood-therapeutics,"Biotechnology, Genetics, Medical, Therapeutics","San Francisco, California, United States","GBT is a clinical-stage biopharmaceutical company developing its lead product candidate, voxelotor, as a therapy for sickle cell disease.","6,893"
GrabOnRent,https://www.crunchbase.com/organization/grabonrent,"Consumer Goods, Mobile, Peer to Peer","Bangalore, Karnataka, India",GrabOnRent is driven by a very simple principle of providing accessibility to products to everyone,"6,899"
Global Telecom & Technology (GTT),https://www.crunchbase.com/organization/global-telecom-technology,"Cloud Computing, Enterprise Software, Mobile, Telecommunications","Mclean, Virginia, United States",Global Telecom & Technology provides custom-fit cloud networking services and enterprise mobility solutions.,"6,937"
GSVlabs,https://www.crunchbase.com/organization/nestgsv,"Coworking, Incubators, Venture Capital","Redwood City, California, United States","GSVlabs is a premium global innovation hub for startups, corporations, and individuals seeking innovation and accelerated growth.","6,951"
GoCanvas,https://www.crunchbase.com/organization/canvas,"Android, Cloud Data Services, iOS, Market Research, Mobile, Productivity Tools, SaaS, Video, Wireless","Reston, Virginia, United States","GoCanvas helps organizations automate their business processes, eliminate paperwork and collect and share information via mobile devices.","6,975"
GI Dynamics,https://www.crunchbase.com/organization/gi-dynamics,"Biotechnology, Medical Device, Therapeutics","Lexington, Massachusetts, United States",GI Dynamics is a medical device company developing therapies for the treatment of type 2 diabetes and related metabolic diseases.,"6,992"
GoBee.Bike,https://www.crunchbase.com/organization/gobee-bike,"Cycling, Public Transportation, Ride Sharing","Wan Chai, Hong Kong Island, Hong Kong",GoBee.Bike is Hong Kong's first station-less bike sharing company.,"7,010"
goTransverse,https://www.crunchbase.com/organization/tract-by-transverse,"Billing, Cloud Computing, Computer, Enterprise Software, FinTech, SaaS, Software, Subscription Service","Austin, Texas, United States","TRACT® by goTransverse is an cloud-based, Internet-scale Agile Monetization Platform (AMP), a.k.a. subscription billing platform","7,024"
"GetWellNetwork, Inc.",https://www.crunchbase.com/organization/getwellnetwork-inc,Software,"Bethesda, Maryland, United States","GetWellNetwork provides patient engagement solutions that help healthcare providers engage, educate and empower patients.","7,026"
Gossamer Bio,https://www.crunchbase.com/organization/gossamer-bio,Health Care,"San Diego, California, United States",A San Diego-based company focused on the discovery and development of novel and differentiated therapeutic products.,"7,027"
Greats,https://www.crunchbase.com/organization/greats-brand,"E-Commerce, Fashion, Shoes","New York, New York, United States",Greats Brands is a men’s footwear brand that offers a wide range of classically-inspired sneakers.,"7,040"
Galapagos,https://www.crunchbase.com/organization/galapagos,Biotechnology,"Mechelen-bovelingen, Limburg, Belgium",Galapagos is a clinical stage biotech company focused on developing novel medicines.,"7,070"
Gabi,https://www.crunchbase.com/organization/gabi,"Auto Insurance, Insurance, Mobile","San Francisco, California, United States",Gabi monitors insurance rates from all carriers and provides unbiased advice on the optimal coverage.,"7,073"
GetMyBoat,https://www.crunchbase.com/organization/getmyboat,"Boating, Marketplace, Rental, Travel","San Francisco, California, United States","GetMyBoat is the world's largest marketplace for boat rentals, yacht charters, and on-the-water experiences.","7,090"
Game Insight,https://www.crunchbase.com/organization/game-insight,"Apps, Gaming, Publishing","Vilnius, Vilniaus Apskritis, Lithuania","Game Insight is a developer and publisher of free-to-play games for Facebook, iPad, iPhone, Android, Amazon, Windows 8 and Windows Phone.","7,097"
Geli,https://www.crunchbase.com/organization/geli,"Energy Storage, Software, Sustainability","San Francisco, California, United States","Geli provides software and business solutions to design, automate, and manage energy storage systems.","7,126"
Good.Co,https://www.crunchbase.com/organization/good-co,"Analytics, Big Data, Human Resources, Internet, Psychology, Recruiting, Social Media","San Francisco, California, United States",The science of relationships & workplace happiness,"7,218"
Gift Voucher Kiosk,https://www.crunchbase.com/organization/gift-voucher-kiosk,"Advertising, Brand Marketing, E-Commerce, Gift Card, Internet, Social Media, Social Media Marketing","Finchley, Barnet, United Kingdom",Always have a gift in your pocket,"7,259"
GlowRoad,https://www.crunchbase.com/organization/glowroad,"E-Commerce, Retail, Social Shopping","Bangalore, Karnataka, India","GlowRoad is world's largest reseller network of 200,000+ resellers selling across 1000+ cities and earning money online.","7,264"
Green House Data,https://www.crunchbase.com/organization/green-house-data,"Cloud Computing, Web Hosting","Cheyenne, Wyoming, United States","Cloud Hosting, Colocation, and Managed Services","7,272"
Gravy Analytics,https://www.crunchbase.com/organization/gravy,"Advertising Platforms, Analytics, Marketing, Mobile Advertising","Dulles, Virginia, United States", Gravy Analytics is the leading provider of real-world consumer insights for advertisers and brands. Visit us at www.gravyanalytics.com.,"7,343"
Groove Labs Inc.,https://www.crunchbase.com/organization/groove-2,"CRM, Sales, Sales Automation","San Francisco, California, United States",Groove is a sales automation platform used by some of the fastest growing companies in the world.,"7,386"
GameAnalytics,https://www.crunchbase.com/organization/gameanalytics,"Analytics, Big Data, Casual Games, SaaS","London, England, United Kingdom","GameAnalytics is an analytics engine that enables game developers to acquire, retain and monetize players.","7,462"
GetNinjas,https://www.crunchbase.com/organization/getninjas,"Classifieds, Local Advertising, Marketplace, Mobile","Sao Paulo, Brazil, South America","GetNinjas is a web-based platform that hires local services such as home renovation, cleaning, private lessons, and more.","7,478"
Gogo,https://www.crunchbase.com/organization/gogo,"Air Transportation, Internet, Manufacturing, Mobile, Telecommunications, Transportation, Travel","Itasca, Illinois, United States",Gogo is a provider of inflight internet and entertainment.,"7,492"
Grabit Inc.,https://www.crunchbase.com/organization/grabit,"Logistics, Manufacturing, Mechanical Engineering, Robotics","Sunnyvale, California, United States",Grabit is transforming manufacturing and warehouse logistics with game changing robotic automation solutions.,"7,512"
Gumroad,https://www.crunchbase.com/organization/gumroad,"Content, Creative Agency, E-Commerce","San Francisco, California, United States",Gumroad owns and operates an online service through which users can buy and sell digital goods such as design templates and source codes.,"7,537"
Gamaya,https://www.crunchbase.com/organization/gamaya,"Agriculture, AgTech, Artificial Intelligence, Big Data, Drones, Robotics","Lausanne, Vaud, Switzerland","Gamaya improves efficiency & sustainability of farming by offering compelling agronomy solutions, enabled by hyperspectral imaging and AI.","7,581"
Greenphire,https://www.crunchbase.com/organization/greenphire,"Analytics, Pharmaceutical, Software","King Of Prussia, Pennsylvania, United States","Greenphire offers a technology-based, customer-driven clinical payment solution.","7,586"
Glue Home,https://www.crunchbase.com/organization/glue-home,"Delivery Service, Home Services, Internet of Things, Smart Home","Stockholm, Stockholms Lan, Sweden","Glue enables smart access for people, products and services into the home while you are away.","7,604"
Globacap,https://www.crunchbase.com/organization/globacap,Blockchain,"London, England, United Kingdom","Globacap is liberating businesses by simplifying, streamlining, and widening access to global capital.","7,657"
Getaway,https://www.crunchbase.com/organization/getaway-2,"Hospitality, Travel","Brooklyn, New York, United States","We offer simple escapes to tiny cabins, nestled in nature.","7,709"
Grana,https://www.crunchbase.com/organization/grana,"E-Commerce, Fashion, Retail","Hong Kong, Hong Kong Island, Hong Kong",Grana is a fashion brand that offers a range of clothes made from a selection of fabrics for men and women.,"7,746"
GENBAND,https://www.crunchbase.com/organization/genband,"Communications Infrastructure, Real Time, Telecommunications, Web Hosting","Plano, Texas, United States","GENBAND is a global supplier of IP gateways, session border controllers and FMC security solutions.","7,756"
Goomo.com,https://www.crunchbase.com/organization/goomo-com,"Hospitality, Travel, Travel Agency","Mumbai, Maharashtra, India","Goomo.com offers fully customizable travel options for individuals, groups, and institutions.","7,762"
goBalto,https://www.crunchbase.com/organization/gobalto,"Biotechnology, Clinical Trials, SaaS, Software","San Francisco, California, United States",goBalto is a software platform that develops cloud-based solutions for drug trial sponsors and clinical research organizations.,"7,778"
Grabhouse,https://www.crunchbase.com/organization/grabhouse,"Commercial Real Estate, Real Estate, Rental, Rental Property","Mumbai, Maharashtra, India",A listing and transactional website for finding rental accommodations.,"7,780"
GoButler / Angel.ai,https://www.crunchbase.com/organization/angel-ai,"Apps, Artificial Intelligence, Internet, Machine Learning, Reservations","New York, New York, United States","Angel.ai, formerly GoButler, is a technology company that supports businesses in automating conversational commerce using NLP.","7,807"
Greenrush,https://www.crunchbase.com/organization/greenrush,"Advertising, E-Commerce, Marijuana, Marketing, Marketplace, Mobile, Online Portals","San Mateo, California, United States",Greenrush facilitates an online marketplace that enables consumers to connect with cannabis dispensary retailers.,"7,827"
GrabFood,https://www.crunchbase.com/organization/grabfood,"E-Commerce, Grocery, Same Day Delivery","London, England, United Kingdom","GrabFood is a same-day grocery delivery company, offering delivery in as little as one hour.","7,873"
GetSmarter,https://www.crunchbase.com/organization/getsmarter,Education,"Cape Town, NA - South Africa, South Africa","GetSmarter, is a digital education company that delivers premium online short courses.","7,927"
GuavaPass,https://www.crunchbase.com/organization/guavapass,"Fitness, Subscription Service, Wellness","Singapore, Asia",One Pass. One Community. GuavaPass gives members access to a community of fitness studios and healthy-living experts.,"8,045"
Golem Factory GmbH,https://www.crunchbase.com/organization/golem-network,Cryptocurrency,"Warsaw, Mazowieckie, Poland",Rent your unused CPU/GPU cycles and get paid in cryptocurrency.,"8,052"
Guilded,https://www.crunchbase.com/organization/guilded,"Gaming, Guides, Online Games","San Francisco, California, United States","Guilded helps gaming teams recruit, improve, and complete.","8,074"
Greenflux,https://www.crunchbase.com/organization/greenflux,"Automotive, Electric Vehicle, Electronics","Amsterdam, Noord-Holland, The Netherlands",Provides technology solutions for electric vehicle charge point infrastructure and engaged as a chargepoint operator,"8,082"
Gas Natural,https://www.crunchbase.com/organization/gas-natural,"Clean Energy, Energy, Oil and Gas, Telecommunications","Barcelona, Catalonia, Spain",Gas Natural is an energy company that provides gas and electricity services.,"8,084"
Green Charge Networks,https://www.crunchbase.com/organization/green-charge-networks,"Energy Storage, Power Grid, Renewable Energy","Santa Clara, California, United States",Green Charge Networks designs and installs commercial energy storage systems.,"8,092"
Generation Tux,https://www.crunchbase.com/organization/generation-tux,"E-Commerce, Fashion, Wearables","Oakland, California, United States",Rent the highest quality tuxedos and suits online without ever visiting a store.,"8,166"
Geofeedia,https://www.crunchbase.com/organization/geofeedia-inc,"Analytics, Location Based Services, SaaS, Social Media, Social Media Management","Chicago, Illinois, United States","Geofeedia is the market leader in location-based social media monitoring, intelligence and analysis for corporate security and more","8,175"
Gamer Sensei,https://www.crunchbase.com/organization/gamer-sensei,"eSports, Online Games, PC Games","Cambridge, Massachusetts, United States",Gamer Sensei takes your game to the next level,"8,185"
Goodbox,https://www.crunchbase.com/organization/goodbox,"Messaging, Mobile Apps, Small and Medium Businesses","Bengaluru, Karnataka, India",Goodbox is a B-B-C Commerce Network that provides Businesses a Mini App & Consumers a Mega App.,"8,190"
Goxip,https://www.crunchbase.com/organization/goxip,"E-Commerce, Fashion, Image Recognition, Marketplace, Mobile, Visual Search","Hong Kong, Hong Kong Island, Hong Kong","Goxip is your ultimate destination for searching, discovering and purchasing any fashion and beauty products you ever desire.","8,258"
Green Cloud Technologies,https://www.crunchbase.com/organization/greencloud-technologies,"Enterprise Software, IaaS, Information Services, Information Technology","Greenville, South Carolina, United States",Green Cloud Technologies provides cloud-based technology solutions to small and medium-sized businesses.,"8,278"
Grokstyle,https://www.crunchbase.com/organization/grokstyle,"Artificial Intelligence, Computer Vision, Developer APIs, Furniture, Image Recognition, Interior Design, Machine Learning, Visual Search","San Francisco, California, United States",Grokstyle develops an app that automatically identifies furniture and home decor from just about any picture or angle.,"8,323"
Good Catch,https://www.crunchbase.com/organization/good-catch,"Cooking, Food and Beverage, Seafood","New York, New York, United States",Delicious plant-based seafood. Inspired by world-renowned chefs.,"8,386"
GLMX,https://www.crunchbase.com/organization/glmx,"Banking, Enterprise Software, Finance, FinTech","Palo Alto, California, United States",GLMX is an electronic securities financing trading platform that offers integrated trading solutions designed for money market participants.,"8,391"
goHenry,https://www.crunchbase.com/organization/gohenry,"Education, Financial Services, Personal Finance","Farnborough, Hampshire, United Kingdom","goHenry is a pre-paid card and application with unique parental controls, for children aged 6 to 18.","8,412"
Guardian Optical Technologies,https://www.crunchbase.com/organization/guardian-optical-technologies,"Automotive, Embedded Software","Tel Aviv, Tel Aviv, Israel",Guardian optical Technologies is an innovative israeli startup developing an advanced 3D sensor.,"8,478"
GAN Integrity Inc,https://www.crunchbase.com/organization/gan-integrity-inc,"Risk Management, SaaS, Training","New York, New York, United States",The All-In-One Compliance Management Software,"8,519"
Goodr,https://www.crunchbase.com/organization/goodr,"Cloud Data Services, Food Delivery, SaaS, Social Innovation, Software, Sustainability, Waste Management","Atlanta, Georgia, United States",Goodr is a sustainable surplus food management platform that leverages technology to reduce food waste and combat hunger.,"8,534"
Goopal Group,https://www.crunchbase.com/organization/goopal-group,Blockchain,,Goopal Group was initiated by the founder and actual controller of Digital China,"8,542"
Geek+,https://www.crunchbase.com/organization/geek,"Logistics, Robotics, Warehousing","Beijing, Beijing, China",Geek+ is a Chinese logistics and warehousing robotics developer.,"8,597"
Genesco,https://www.crunchbase.com/organization/genesco,"E-Commerce, Retail","Nashville, Tennessee, United States","Genesco operates Journeys, Journeys Kidz, and Shi by Journeys stores that offer footwear for young men and women.","8,641"
GameChanger Media,https://www.crunchbase.com/organization/gamechanger-media,"Apps, Internet, iOS, Local, Mobile, Software, Sports","New York, New York, United States","GameChanger is a mobile app and website providing scorekeeping, stats, live gamestream plays, and recap stories for amateur sports teams.","8,708"
Genmab,https://www.crunchbase.com/organization/genmab,"Biotechnology, Health Care, Medical","Copenhagen, Hovedstaden, Denmark",Genmab is a biotechnology company focused on developing fully human antibody therapeutics for the potential treatment of cancer.,"8,717"
Grain,https://www.crunchbase.com/organization/grain,"E-Commerce, Food and Beverage, Food Delivery","Singapore, Central Region, Singapore",Restaurant 2.0,"8,728"
GetFeedback,https://www.crunchbase.com/organization/getfeedback,"Customer Service, Enterprise Software, Market Research, Software","San Francisco, California, United States","GetFeedback helps companies understand and improve customer experience by making it easy to create beautiful, branded surveys.","8,740"
Goodpatch,https://www.crunchbase.com/organization/goodpatch,Software,"Tokyo, Tokyo, Japan",Goodpatch is a Tokyo-based company developing and designing user interfaces for web companies.,"8,756"
GirnarSoft,https://www.crunchbase.com/organization/girnarsoft,"Developer Tools, Enterprise Software, Mobile, Web Development","Jaipur, Rajasthan, India",GirnarSoft (SEZ) Pvt. Ltd. is a business value focused IT company working on offshore and outsourced software development.,"8,772"
Glassbeam,https://www.crunchbase.com/organization/glassbeam-inc,"Analytics, Internet of Things, SaaS, Software","Santa Clara, California, United States",Glassbeam provides a SaaS-based solution for product analytics based on machine log data.,"8,790"
Gridspace,https://www.crunchbase.com/organization/gridspace,"Business Development, Software, Speech Recognition","San Francisco, California, United States",Speech software for managing real-time communications,"8,823"
