Organization Name,Organization Name URL,Categories,Headquarters Location,Description,CB Rank (Company)
GRAIL,https://www.crunchbase.com/organization/grail,"Health Care, Health Diagnostics, Life Science, Medical Device","Menlo Park, California, United States",GRAIL develops a blood test to detect cancer early before symptoms appear offering higher survival rates compared to late-stage diagnosis.,"11,684"
Gemini Therapeutics,https://www.crunchbase.com/organization/gemini-therapeutics,"Biopharma, Biotechnology, Health Diagnostics","Cambridge, Massachusetts, United States",Gemini Therapeutics,"11,776"
GenSight Biologics,https://www.crunchbase.com/organization/gensight-biologics,"Biotechnology, Genetics, Health Care, Medical","Paris, Ile-de-France, France",GenSight Biologics develops gene therapy-based treatments for retinal degenerative diseases.,"11,782"
GigaGen,https://www.crunchbase.com/organization/gigagen,"Biotechnology, Genetics, Medical, Therapeutics","South San Francisco, California, United States",Overcoming Immune Dysregulation to Fight Disease,"11,824"
Geekatoo,https://www.crunchbase.com/organization/geekatoo,"Auctions, Hardware, Local, Search Engine","Mountain View, California, United States","Geekatoo offers at-home tech support services such as computer repair, virus removal, camera and printer repair and building websites.","11,865"
gr8 People,https://www.crunchbase.com/organization/gr8-people,"Collaboration, Human Resources, Recruiting","Newtown, Pennsylvania, United States",gr8 People develops enterprise recruiting software solutions for RPO and corporate enterprises.,"11,877"
Genomenon,https://www.crunchbase.com/organization/genomenon,"Developer Tools, Enterprise Software, Genetics, Medical","Ann Arbor, Michigan, United States",Genomenon develops software tools to rapidly and autonomously prioritize data points for decision-making.,"11,905"
Gestoos,https://www.crunchbase.com/organization/gestoos,"Artificial Intelligence, Digital Signage, Human Computer Interaction, Internet of Things, Retail Technology","Barcelona, Catalonia, Spain",Gestoos develops an Artificial Intelligence software that can recognize people’s gestures and behavior in real-time.,"11,906"
Glue Networks,https://www.crunchbase.com/organization/glue-networks,"Cloud Computing, Enterprise Software, Service Industry","Sacramento, California, United States",Glue Networks provides an enterprise-grade cloud networking service for service providers and value-added resellers.,"11,951"
GenePeeks,https://www.crunchbase.com/organization/genepeeks,"Biotechnology, Genetics","New York, New York, United States",GenePeeks is a genetic information company,"11,983"
Groundspeed Analytics,https://www.crunchbase.com/organization/groundspeed-analytics,Insurance,"Ann Arbor, Michigan, United States","Groundspeed provides automation and analytics services to commercial insurers, brokers and TPAs.","11,985"
Gizmoz,https://www.crunchbase.com/organization/gizmoz,"3D Technology, Developer Tools","Menlo Park, California, United States",Gizmoz develops proprietary patented 3D and animation technology to let users express themselves by creating realistic 3D characters.,"12,005"
Giggle,https://www.crunchbase.com/organization/giggle,"E-Commerce, Online Auctions, Retail","New York, New York, United States",Giggle operates as an online multichannel retailer of baby care products.,"12,009"
Gryphon Group Holdings,https://www.crunchbase.com/organization/gryphon-group-holdings,"Finance, Financial Services, Insurance","London, England, United Kingdom",A UK start-up insurer which is planning to sell life insurance in the UK.,"12,016"
Geo Semiconductor,https://www.crunchbase.com/organization/geo-semiconductor,"Cloud Computing, Enterprise Software, Semiconductor","Santa Clara, California, United States",Geo Semiconductor is a fabless semiconductor company that designs video and geometry processing integrated circuits (ICs).,"12,037"
Graze,https://www.crunchbase.com/organization/graze,"E-Commerce, Food Delivery, Organic Food","New York, New York, United States","Graze is an online snack retailer delivering natural food, flapjacks, cakes and popcorn to residential homes or workplaces daily via post.","12,050"
German Autolabs,https://www.crunchbase.com/organization/german-autolabs,"Automotive, Internet of Things, Navigation","Berlin, Berlin, Germany","German Autolabs is a Berlin based technology company, focussing on the future of the car. Making every car smarter and safer.","12,093"
G Suite Coupon Code,https://www.crunchbase.com/organization/g-suite-coupon-code,,,Get G Suite (earlier Google Apps for Work) Coupon Code & Get 20% off on subscription. http://choicedelhi.in/recommended/gsuite,"12,114"
Gradle,https://www.crunchbase.com/organization/gradle,"Developer Tools, Enterprise Software, Information Technology, Open Source, SaaS, Software","San Francisco, California, United States","Gradle is the company behind both the popular open source Gradle Build Tool and our commercial product, Gradle Enterprise.","12,116"
Graphic India,https://www.crunchbase.com/organization/graphic-india,"Comics, Film, Mobile, Publishing","Singapore, Central Region, Singapore",Mobile Content & Character Entertainment Company,"12,142"
Gynesonics,https://www.crunchbase.com/organization/gynesonics,"Health Care, Hospital, Medical","Redwood City, California, United States",Gynesonics develops an ablation device for treating uterine fibroids.,"12,156"
"G1 Therapeutics, Inc.",https://www.crunchbase.com/organization/g1-therapeutics,"Biotechnology, Medical, Therapeutics","Durham, North Carolina, United States",G1 Therapeutics is a clinical-stage company developing small-molecule therapies to address significant unmet needs in oncology.,"12,213"
GoCo.io Inc,https://www.crunchbase.com/organization/goco-io-inc,"Employee Benefits, Human Resources, SaaS","Houston, Texas, United States",GoCo.io offers software that helps businesses simplify their human resources systems.,"12,295"
Glofox,https://www.crunchbase.com/organization/glofox,"B2B, Fitness, SaaS, Software","Dublin, Dublin, Ireland",Glofox is a gym-studio management software for a mobile age.,"12,298"
GC Aesthetics,https://www.crunchbase.com/organization/gc-aesthetics,"Health Care, Manufacturing, Medical Device","Sandyford, Dublin, Ireland","GC Aesthetics is a designer, manufacturer, and distributor of medical devices for the global aesthetics industry. ","12,331"
Graylog,https://www.crunchbase.com/organization/graylog,"Analytics, Enterprise Software, Open Source, Software","Houston, Texas, United States","Graylog is a fully integrated platform for collecting, indexing, and analyzing log messages.","12,344"
GoFormz,https://www.crunchbase.com/organization/goformz,"Cloud Computing, Developer Tools, Mobile, SaaS","San Diego, California, United States",GoFormz is helping customers to transform into data-driven businesses with its mobile-first business productivity platform.,"12,352"
Green Blender,https://www.crunchbase.com/organization/green-blender,Food Processing,"Long Island City, New York, United States",A smoothie delivery service that makes it fun and easy to indulge in your health.,"12,354"
Grupa Pracuj,https://www.crunchbase.com/organization/grupa-pracuj,"Employment, Human Resources, Recruiting, SaaS","Warsaw, Mazowieckie, Poland","Grupa Pracuj, the owner of GP HR VENTURES, is the fastest developing technological companies in Central Europe providing HR solutions.","12,369"
Good Parents Inc.,https://www.crunchbase.com/organization/good-parents-inc,"Children, Wearables, Wellness","San Francisco, California, United States",Kiddo - The worlds 1st health and wellness wearable for young kids (4-10 years olds),"12,422"
GenomeDx Biosciences,https://www.crunchbase.com/organization/genomedx-biosciences,"Biotechnology, Genetics, Health Care, Medical","Vancouver, British Columbia, Canada","GenomeDx discovers, develops, and commercializes genomic-based laboratory tests for the personalized medicine revolution in cancer care.","12,423"
GIGAS,https://www.crunchbase.com/organization/gigas,"Cloud Computing, IaaS, Virtualization, Web Hosting","Madrid, Madrid, Spain","Gigas is a leading cloud service provider in Spain and Latinamerica, offering mission critical high quality services to business customers","12,430"
Glownet,https://www.crunchbase.com/organization/glownet,"Events, NFC, PaaS, Payments, RFID, SaaS, Software","London, England, United Kingdom","SaaS Operating Platform for Live Events (music festivals, sports, conferences)","12,458"
Giftagram,https://www.crunchbase.com/organization/giftagram,Internet,"Toronto, Ontario, Canada","Gifting just got easier with Giftagram, a mobile gift-giving app available on iPhone, iPad, and Android.","12,485"
Gustav,https://www.crunchbase.com/organization/gustav,"Human Resources, Marketplace, Recruiting","San Francisco, California, United States",Gustav is vendor management system (VMS) built for the needs of the midmarket.,"12,523"
grandPad,https://www.crunchbase.com/organization/grandpad,"Computer, Consumer Electronics, Mobile, Software","Orange, California, United States",grandPad is a tablet computer that digitally connects senior citizens to their family and friends.,"12,565"
G7,https://www.crunchbase.com/organization/g7,"Logistics, Service Industry, Transportation","Beijing, Beijing, China","G7 is a fleet management service provider in China that offers IoT/AI services to over 500,000 vehicles. ","12,602"
Gridstore,https://www.crunchbase.com/organization/gridstore,Data Center,"Mountain View, California, United States",Gridstore is the leader in HyperConverged All-Flash Infrastructure for the Cloud-Inspired Data Center. ,"12,709"
Gnowbe,https://www.crunchbase.com/organization/gnowbe,"Corporate Training, E-Learning, Higher Education, Human Resources","Singapore, Asia","Gnowbe is a leading mobile 1st,  micro-learning solution designed for enterprise.","12,728"
Green City Solutions GmbH,https://www.crunchbase.com/organization/green-city-solutions-gmbh,"Architecture, Biotechnology, Clean Energy, CleanTech, Environmental Engineering, Internet of Things, Renewable Energy, Sustainability","Berlin, Berlin, Germany",Green City Solutions GmbH addresses the global problem of air pollution by combining a installed moss culture with IoT technology. ,"12,743"
GeoQuant,https://www.crunchbase.com/organization/geoquant,"Analytics, Information Services, Information Technology, Intelligent Systems, Risk Management, Software","San Francisco, California, United States",GeoQuant is a revolutionary platform that fuses political science with computer science to help global investors.,"12,783"
GawkBox,https://www.crunchbase.com/organization/gawkbox,"App Marketing, Gaming, Mobile Advertising, Social Media Advertising","Seattle, Washington, United States","GawkBox is enabling content creators to make a better living. GawkBox is enabling content creators on YouTube, Mixer & Twitch to m","12,823"
GAMEE,https://www.crunchbase.com/organization/gamee,"Apps, Casual Games, Mobile, Social Network","Prague, Hlavni mesto Praha, Czech Republic",Gamee is a battle gaming network that makes games playable & shareable with friends across app and messaging apps.,"12,852"
Garmentory,https://www.crunchbase.com/organization/garmentory,"E-Commerce, Fashion, Retail","Seattle, Washington, United States",Garmentory is the marketplace for contemporary and emerging fashion. We hand select the best designers and boutiques around the world.,"13,022"
GetApp,https://www.crunchbase.com/organization/getapp,"App Marketing, Apps, Cloud Computing, Enterprise Software, SaaS, Software","Barcelona, Catalonia, Spain","GetApp is the premier online resource for businesses exploring software as a service (SaaS). Free interactive tools, comparisons, reviews.","13,037"
Govini,https://www.crunchbase.com/organization/govini,"Analytics, Business Intelligence, Database","San Francisco, California, United States",Govini is the leading business intelligence platform,"13,103"
Gini,https://www.crunchbase.com/organization/gini,"Artificial Intelligence, Developer APIs, Document Management, Internet, Machine Learning, Semantic Search, Social Media","München, Bayern, Germany",Gini provides a SaaS solution for extracting content from documents.,"13,159"
Gecko Biomedical,https://www.crunchbase.com/organization/gecko-biomedical,"Biotechnology, Health Care, Medical Device","Paris, Ile-de-France, France",Gecko Biomedical develops biodegradable sealants and adhesives for wound closure in the field of minimally-invasive surgery.,"13,219"
Glance Networks,https://www.crunchbase.com/organization/glance,"Customer Service, E-Commerce, Enterprise Software","Arlington Heights, Massachusetts, United States","Glance improves the way businesses interact with their customers with next generation cobrowse, screen share and agent video technology.","13,240"
Gluru,https://www.crunchbase.com/organization/gluru,"Machine Learning, Software","London, England, United Kingdom","Gluru is an advanced analytical & predictive user data software company, making unstructured user data smart.","13,270"
Goodnight Midstream,https://www.crunchbase.com/organization/goodnight-midstream,"Oil and Gas, Waste Management","Dallas, Texas, United States",Goodnight Midstream is a provider of water handling and salt water disposal services to the oil and gas industry.,"13,285"
Genesis Financial Solutions,https://www.crunchbase.com/organization/genesis-financial-solutions,"Consumer, Finance, Financial Services, FinTech","Beaverton, Oregon, United States",Genesis Financial Solutions provides consumer financing options for merchants and service providers in the United States.,"13,325"
Growth Street,https://www.crunchbase.com/organization/growth-street,"Financial Services, FinTech, Small and Medium Businesses","London, England, United Kingdom","Fast, flexible overdrafts for growing businesses","13,362"
"Gobiquity, Inc.",https://www.crunchbase.com/organization/gobiquity-inc,"Biotechnology, Health Care, Mobile Apps","Scottsdale, Arizona, United States",ICHECK Health Connection provides mobile applications for the early detection and tracking of eye diseases in the United States.,"13,363"
Greensmith Energy Management Systems,https://www.crunchbase.com/organization/greensmith-energy-management-systems,"Energy, Energy Storage, Renewable Energy","Rockville, Maryland, United States","Greensmith provides system integration, battery controls, web-based software, and data analytics for stationary energy storage systems.","13,397"
Ganji,https://www.crunchbase.com/organization/ganji,"Classifieds, Information Services, Internet","Beijing, Beijing, China","Ganji.com is a Chinese domestic classifieds website where users publish and exchange local information such as used cars, jobs, and more.","13,409"
Grow Fit,https://www.crunchbase.com/organization/grow-fit,"Health Care, Mobile Apps","Bangalore, Karnataka, India",Grow Fit is a mobile health companion that uses artificial intelligence.,"13,475"
Grace,https://www.crunchbase.com/organization/grace-3,"Elder Care, Funerals, Health Care","Santa Monica, California, United States",Grace is find peace of mind for end-of-life planning.,"13,548"
Gainspeed,https://www.crunchbase.com/organization/gainspeed,"Communications Infrastructure, Telecommunications, Video","Sunnyvale, California, United States",Gainspeed is redefining how cable networks are built.,"13,563"
Growlife,https://www.crunchbase.com/organization/growlife,"Farming, Hydroponics, Logistics, Manufacturing, Supply Chain Management","Seattle, Washington, United States",GrowLife is a cultivation facilities service provider.,"13,629"
GENWI,https://www.crunchbase.com/organization/genwi,Mobile,"Los Altos, California, United States",GENWI enables content publishers to create live and engaging apps with a cloud-based mobile Content Management System (mCMS).,"13,733"
Grainsense Oy,https://www.crunchbase.com/organization/grainsense-oy,"Agriculture, Farming, Technical Support","Oulu, Oulu, Finland",We have developed the world’s first truly hand-held device for grain protein measurement.,"13,775"
GigSky,https://www.crunchbase.com/organization/gigsky,"Mobile, Mobile Devices, Travel, Wireless","Palo Alto, California, United States",GigSky is mobile data connectivity solution for travelers. The service was launched in June 2015 on Apple SIM for iPad in over 90 countries.,"13,789"
GenXComm,https://www.crunchbase.com/organization/genxcomm,"Information Services, Information Technology, Wireless","Austin, Texas, United States",GenXComm enables true full duplex for next generation communications infrastructure.,"13,870"
Gamblit Gaming,https://www.crunchbase.com/organization/gamblit-gaming,"Information Technology, Internet, Video Games","Glendale, California, United States","Gamblit Gaming is the leading technology provider in the emerging interactive entertainment meets gambling space, enabling a wide range of","13,933"
G -Therapeutics,https://www.crunchbase.com/organization/g-therapeutics,"Biotechnology, Medical Device, Therapeutics","Lausanne, Vaud, Switzerland",G-Therapeutics SA develops and offers an implantable stimulation system and a robot-assisted training program to rehabilitate individuals.,"13,979"
Genoa Pharmaceuticals,https://www.crunchbase.com/organization/genoa-pharmaceuticals,"Biopharma, Biotechnology, Medical","San Diego, California, United States",Genoa Pharmaceuticals develops therapies for the treatment of idiopathic pulmonary fibrosis.,"14,016"
GEOLID,https://www.crunchbase.com/organization/geolid,Advertising,"Lyon, Rhone-Alpes, France",Geolid is a French search optimization website that provides local advertising services.,"14,021"
GoMeta,https://www.crunchbase.com/organization/gometa,"Augmented Reality, Developer Platform, Mobile Apps","San Diego, California, United States","GoMeta allows non-technical individuals and organizations to create, share, and discover Augmented Reality experiences.","14,035"
G2 Crowd,https://www.crunchbase.com/organization/g2-crowd,"Enterprise Software, Internet, Marketing Automation, SaaS","Chicago, Illinois, United States",G2 Crowd is a platform for users to share business software reviews in real-time.,"14,067"
Gigaclear,https://www.crunchbase.com/organization/gigaclear,"Optical Communication, Telecommunications, Web Hosting","Chipping Norton, Oxfordshire, United Kingdom",Gigaclear is a private company dedicated to building and operating Ultrafast broadband networks based on pure fibre technology.,"14,081"
Gold Farm,https://www.crunchbase.com/organization/gold-farm,,"Coimbatore, Tamil Nadu, India",India's emerging Agri Platform,"14,103"
Gridco,https://www.crunchbase.com/organization/gridco,"CleanTech, Energy Management, Hardware, Oil and Gas","Woburn, Massachusetts, United States",Gridco develops power management solutions for electric utilities.,"14,180"
GreatSchools.org,https://www.crunchbase.com/organization/greatschools-org,"Education, Non Profit","Oakland, California, United States",GreatSchools is a nonprofit organization that offers information sharing services on public and private schools to students and parents.,"14,258"
GPM Investments,https://www.crunchbase.com/organization/gpm-investments,Retail,"Richmond, Virginia, United States",GPM Investments owns and operates a chain of convenience stores.,"14,291"
Grab,https://www.crunchbase.com/organization/grab-2,"Delivery, Enterprise Software, Logistics","Mumbai, Maharashtra, India",Grab is India's leading on demand last mile logistics service for merchants & small businesses.,"14,313"
Gratafy,https://www.crunchbase.com/organization/gratafy,"E-Commerce, Gift Card, Hospitality, Mobile, Nightlife","Seattle, Washington, United States",Gratafy is an award-winning mobile gifting platform that allows users to instantly gift unique menu items like a bottle of wine .,"14,351"
Giant Swarm,https://www.crunchbase.com/organization/giant-swarm,"Cloud Computing, Information Technology","Cologne, Nordrhein-Westfalen, Germany",Managed Kubernetes Anywhere,"14,437"
Gigoptix,https://www.crunchbase.com/organization/gigoptix,"Electronics, Semiconductor, Wireless","San Jose, California, United States",GigOptix provides semiconductor and optical components that enable high-speed information streaming.,"14,442"
Gooten,https://www.crunchbase.com/organization/breakout-commerce,"E-Commerce, Manufacturing, Mobile","Manhattan, New York, United States",The leading online marketplace for manufacturing,"14,446"
Gameflip,https://www.crunchbase.com/organization/gameflip,,,Gameflip is the simplest and easiest way to buy and sell everything video game related.,"14,473"
Greenqloud,https://www.crunchbase.com/organization/greenqloud,"Cloud Infrastructure, Enterprise Software, Information Technology, Private Cloud","Reykjavík, Gullbringusysla, Iceland","Greenqloud is a software company focusing on their premier software, Qstack, a leading Cloud Management Platform (CMP).","14,477"
Groupize.com,https://www.crunchbase.com/organization/groupize-com,Hospitality,"Gloucester, Massachusetts, United States","Groupize.com helps the hotel industry attract group travelers by providing automated shopping, booking, collaboration and planning.","14,494"
GrowthIntel,https://www.crunchbase.com/organization/growth-intelligence,"Big Data, Business Intelligence, Enterprise Software, Real Time, Risk Management","London, England, United Kingdom",Growth Intelligence is a UK technology company offering a software-as-a-service product to B2B corporations.,"14,520"
Games2Win,https://www.crunchbase.com/organization/games2win,"Ad Network, Apps, Network Security, Video Games","Mumbai, Maharashtra, India","Games2Win offers online gaming portals, proprietary games, in-game ad networks, and mobile social networks for applications and games.","14,535"
Genomic Expression,https://www.crunchbase.com/organization/genomic-expression,"Biotechnology, Health Care, Medical","New York, New York, United States",Genomic Expression’s technology takes the guesswork out of the process of developing personal diagnostics.,"14,538"
Galera Therapeutics,https://www.crunchbase.com/organization/galera-therapeutics,"Biotechnology, Life Science, Therapeutics","Malvern, Pennsylvania, United States",Galera Therapeutics develops therapeutic agents for preventing damage to normal tissues during the radiation treatment of cancer.,"14,545"
Green Biologics,https://www.crunchbase.com/organization/green-biologics,"Biotechnology, Chemical, Chemical Engineering","Abingdon, Oxfordshire, United Kingdom",Green Biologics offers fermentation technologies for the conversion of biomass to renewable fuels and chemicals.,"14,563"
Gunosy,https://www.crunchbase.com/organization/gunosy,"Apps, Mobile, News, Politics","Tokyo, Tokyo, Japan",Gunosy is a news curation application that covers a wide range of news from entertainment news to political news.,"14,570"
Guardhat Technologies,https://www.crunchbase.com/organization/gaurdhat-technologies,"Analytics, Industrial Automation, Wearables","Southfield, Michigan, United States","Guardhat is a multi-product, feature-packed intelligent safety system that integrates cutting edge wearable technology.","14,580"
GoFro,https://www.crunchbase.com/organization/gofro,"Tourism, Travel","New Delhi, Delhi, India",GoFro was born out of our firm belief in empowering the modern traveller with flexibility of choices,"14,613"
Gaist Holdings,https://www.crunchbase.com/organization/gaist-solutions,"Consulting, Information Technology, Software","Lancaster, Lancashire, United Kingdom","Gaist Limited is a technology company focussed on providing consultancy and software solutions to the highways, transportation.","14,627"
Gemvara,https://www.crunchbase.com/organization/gemvara,"E-Commerce, Internet, Jewelry, Retail","Boston, Massachusetts, United States",Gemvara is an online shopping store delivering custom-made fine jewelry.,"14,693"
Goby,https://www.crunchbase.com/organization/goby-llc,"CleanTech, Cloud Data Services, Consulting, Energy Management, Information Technology, SaaS","Chicago, Illinois, United States","Goby is the leading energy management, sustainability reporting, and invoice automation platform for the commercial real estate industry.","14,701"
GrayMeta,https://www.crunchbase.com/organization/graymeta,"Artificial Intelligence, Digital Media, Information Technology, Machine Learning","Thousand Oaks, California, United States",GrayMeta™ dramatically improves efficiencies by automating the creation of metadata with an innovative approach to extracting rich metadata.,"14,711"
Geostellar,https://www.crunchbase.com/organization/geostellar,"Analytics, Big Data, Biofuel, Clean Energy, Geospatial, Location Based Services, Solar","Martinsburg, West Virginia, United States","Geostellar is a solar energy marketplace and patented platform to instantly & interactively tailor equipment, financing and installation.","14,731"
Gamma 2 Robotics,https://www.crunchbase.com/organization/gamma-2-robotics,"Real Time, Robotics, Security","Denver, Colorado, United States","Gamma 2 Robotics has developed the only available intelligent and autonomous robots that detect and report on intruders, fire and more.","14,832"
Genbook,https://www.crunchbase.com/organization/genbook,"Local, Mobile, Reputation, Search Engine, Software","San Francisco, California, United States",Genbook is a SaaS & mobile platform enabling businesses to schedule appointments with its customers.,"14,904"
Gojob,https://www.crunchbase.com/organization/gojob,"Human Resources, Recruiting, Staffing Agency","Aix-en-provence, Provence-Alpes-Cote d'Azur, France",Gojob is a marketplace for temporary workers.,"14,950"
GreenSight Agronomics,https://www.crunchbase.com/organization/greensight-agronomics,"Agriculture, Drones, Robotics, Sustainability, Water","Boston, Massachusetts, United States",GreenSight Provides an Autonomous Intelligence Platform for High-End Agriculture and Golf Courses,"14,955"
