Organization Name,Organization Name URL,Categories,Headquarters Location,Description,CB Rank (Company)
Grab,https://www.crunchbase.com/organization/grabtaxi,"Internet, Mobile, Ride Sharing, Transportation, Travel","Midview City, Central Region, Singapore","Grab is a ride-hailing platform that offers booking service for taxis, private cars, and motorbikes through one mobile.",23
GO-JEK,https://www.crunchbase.com/organization/go-jek,"Apps, Delivery, Food Processing, Logistics, Payments, Same Day Delivery, Transportation","Jakarta, Jakarta Raya, Indonesia","GO-JEK provides services that include transportation, logistics, mobile payments, food delivery, and many other on-demand services",58
General Motors,https://www.crunchbase.com/organization/general-motors,"Automotive, Enterprise Software, Manufacturing, Transportation","Detroit, Michigan, United States","General Motors is a Detroit-based mutinational corporation that manufactures, markets, and distributes vehicles and vehicle parts.",62
Glassdoor,https://www.crunchbase.com/organization/glassdoor,"Career Planning, Employment, Recruiting, Social Media","Mill Valley, California, United States","Glassdoor is a jobs and recruiting marketplace headquartered in Mill Valley, California.",68
Groupon,https://www.crunchbase.com/organization/groupon,"Advertising, Internet, Retail, Social Media","Chicago, Illinois, United States",Groupon is a deal-of-the-day website that offers discounted gift certificates usable at local or national companies.,82
GreenSky,https://www.crunchbase.com/organization/greensky,"Consumer Lending, Credit, Financial Services","Atlanta, Georgia, United States",GreenSky offers fast and paperless solutions and financial services to businesses of all sizes.,85
General Electric (GE),https://www.crunchbase.com/organization/general-electric,"Electronics, Energy, Energy Management, Finance, FinTech, Manufacturing","Fairfield, Connecticut, United States",General Electric Company offers infrastructure and financial services worldwide.,100
General Assembly,https://www.crunchbase.com/organization/general-assembly,"Education, UX Design, Web Development","New York, New York, United States","General Assembly is a pioneer in education and career transformation, specializing in today’s most in-demand skills.",117
Gett,https://www.crunchbase.com/organization/get-taxi,"Delivery, Logistics, Ride Sharing, Transportation","New York, New York, United States",Gett is a global transportation and delivery company.,120
Goldman Sachs,https://www.crunchbase.com/organization/goldman-sachs,"Banking, Finance, Financial Services, Security, Venture Capital","New York, New York, United States","Goldman Sachs is a multinational financial services firm providing securities, and investment banking and management services.",212
Goop ,https://www.crunchbase.com/organization/goop,"Beauty, Content, E-Commerce, Fashion, Health Care, Travel, Wellness","Los Angeles, California, United States",Goop is a lifestyle brand providing digital content and commerce.,216
GoPro,https://www.crunchbase.com/organization/gopro,"3D Technology, Consumer Electronics, Hardware, Photography, Software, Video, Wearables","San Mateo, California, United States",GoPro is a brand of personal cameras used in extreme action video photography.,248
GGV Capital,https://www.crunchbase.com/organization/ggv-capital,"Business Development, Financial Services, Venture Capital","Menlo Park, California, United States",GGV Capital is a $3.8 billion multi-stage venture capital firm based in Silicon Valley and China.,258
Google,https://www.crunchbase.com/organization/google,"Ad Network, Artificial Intelligence, Blogging Platforms, Collaboration, Email, Enterprise Software, Information Technology, Machine Learning, Search Engine, Video Streaming","Mountain View, California, United States",Google is a multinational corporation that is specialized in internet-related services and products.,300
Getaround,https://www.crunchbase.com/organization/getaround,"Car Sharing, Collaborative Consumption, Mobile, Transportation","San Francisco, California, United States",Getaround is a mobile application and a peer-to-peer car sharing marketplace that enables car owners to rent out their cars.,339
GOAT,https://www.crunchbase.com/organization/goatapp,"E-Commerce, Fashion, Marketplace, Mobile","Culver City, California, United States",GOAT is a marketplace for buying and selling sneakers and streetwear.,365
Gusto,https://www.crunchbase.com/organization/gusto,"Employee Benefits, Enterprise Software, Financial Services, FinTech, Human Resources, Personal Finance, SaaS","San Francisco, California, United States","With a mission to create a world where work empowers a better life, Gusto automates and simplifies payroll, benefits, and HR for businesses.",408
Grindr,https://www.crunchbase.com/organization/grindr,"Apps, iOS, LGBT, Location Based Services, Social Media, Social Network","West Hollywood, California, United States","Grindr is an all-male location-based network that allows gay, bi, or curious men to connect and hang out with one another.",409
Gilt Groupe,https://www.crunchbase.com/organization/gilt-groupe,"E-Commerce, Fashion, Furniture, Lifestyle, Shopping","New York, New York, United States",Gilt Groupe is an online shopping website that provides instant insider access to top designer labels.,416
GitHub,https://www.crunchbase.com/organization/github,"Cloud Computing, Developer Tools, Internet, Project Management, Software","San Francisco, California, United States",GitHub is a web-based Git repository hosting service offering distributed revision control and source code management functionality of Git.,426
GrubHub,https://www.crunchbase.com/organization/grubhub,"Food Delivery, Hospitality, Restaurants","Chicago, Illinois, United States","GrubHub allows users to find and order food from restaurants in their vicinity that deliver or offer pickup, via an app and a website.",432
Gazprom,https://www.crunchbase.com/organization/gazprom,"Business Intelligence, Energy, Energy Efficiency","Moscow, Moscow City, Russian Federation","Gazprom is a global energy company. Its major business lines are geological exploration, production, transportation, storage, processing",447
Greenko Group,https://www.crunchbase.com/organization/greenko-group,"Clean Energy, Energy, Wind Energy","Hyderabad, Andhra Pradesh, India","Greenko Group, based in India, is an independent power producer developing clean energy assets.",452
Gotham Greens,https://www.crunchbase.com/organization/gotham-greens,"Agriculture, Food Processing, Retail","Brooklyn, New York, United States","Gotham Greens designs, builds, and operates commercial scale greenhouse facilities in urban areas for fresh vegetable production.",497
Good Eggs,https://www.crunchbase.com/organization/good-eggs,"Delivery, E-Commerce, FMCG, Grocery","San Francisco, California, United States","Good Eggs is a pioneering online grocer and meal kit delivery service with a mission to reinvent your food system, for good. ",502
Grove,https://www.crunchbase.com/organization/grove-5,"Advice, Finance, Financial Services, FinTech",,Grove offers a personalized financial planning and advice at a fraction of the price of traditional financial advisers.,543
Grammarly,https://www.crunchbase.com/organization/grammarly,"Apps, Artificial Intelligence, Blogging Platforms, Education, Mobile Apps, Productivity Tools","San Francisco, California, United States",Grammarly’s AI-powered products help people communicate more effectively.,558
GREYSTAR,https://www.crunchbase.com/organization/greystar,"Construction, Property Management, Real Estate","Charleston, South Carolina, United States","Greystar, founded in 1993, provides world-class service in the multifamily real estate business.",620
Godrej Properties,https://www.crunchbase.com/organization/godrej-properties,"Architecture, Commercial Real Estate, Real Estate, Real Estate Investment","Mumbai, Maharashtra, India",Godrej Properties brings the Godrej Group philosophy of innovation and excellence to the real estate industry.,665
Guild Education,https://www.crunchbase.com/organization/guild-education,"Career Planning, Education, Employee Benefits","Denver, Colorado, United States","Guild Education's lifelong learning platform offers classes, programs, and degrees for working adults.",684
Giphy,https://www.crunchbase.com/organization/giphy,"Internet, Photo Sharing, Search Engine","New York, New York, United States","Giphy allows users to search, share, and discover best GIFs.",719
Ginkgo Bioworks,https://www.crunchbase.com/organization/ginkgo-bioworks,"Biotechnology, Health Care, Medical","Boston, Massachusetts, United States",Ginkgo designs custom microbes for customers across multiple markets.,796
GoKid,https://www.crunchbase.com/organization/gokid,"Children, Mobile Apps, Ride Sharing, Transportation","New York, New York, United States",The GoKid mobile app lets parents manage their children's transportation needs by easily setting up carpools with other families.,810
Green Bits,https://www.crunchbase.com/organization/green-bits,"Marijuana, Point of Sale, Retail Technology, SaaS, Small and Medium Businesses, Software","San Jose, California, United States",Green Bits is a retail management and point-of-sale platform that helps legal cannabis retailers grow their businesses,819
Grove Collaborative,https://www.crunchbase.com/organization/epantry-llc,"Consumer Goods, E-Commerce, Internet, Retail, Sustainability","San Francisco, California, United States","Home and personal care products that make it easy to create a healthy, beautiful home.",867
Grofers,https://www.crunchbase.com/organization/grofers-trusted-delivery-partner,"E-Commerce, Grocery, Internet, Retail","Gurgaon, Haryana, India","Grofers offers on-demand, next-day deliveries from local merchants to consumers.",921
Glooko,https://www.crunchbase.com/organization/glooko,"Analytics, Diabetes, Health Care, mHealth, Mobile Apps","Palo Alto, California, United States",Glooko is the Unified Platform for Diabetes Management.,953
General Dynamics,https://www.crunchbase.com/organization/general-dynamics,"Aerospace, National Security, Public Transportation","Falls Church, Virginia, United States","General Dynamics is a defense industry contractor for shipbuilding, marine, combat and defense systems and, munitions.","1,034"
Grovo,https://www.crunchbase.com/organization/grovo,"EdTech, Education, Enterprise Software, Human Resources, SaaS, Training","New York, New York, United States",The world's leading Microlearning solution,"1,042"
GetYourGuide,https://www.crunchbase.com/organization/getyourguide,"Internet, Tourism, Travel","Berlin, Berlin, Germany","GetYourGuide is a booking platform for tours and activities, offering a variety of travel experiences through their global supplier network.","1,089"
Gigya,https://www.crunchbase.com/organization/gigya,"Computer, Enterprise Software, Identity Management","Mountain View, California, United States","Gigya offers a Customer Identity Management Platform that businesses can use to identify customers, aggregate data & personalize campaigns.","1,117"
GW Pharmaceuticals,https://www.crunchbase.com/organization/gw-pharmaceuticals,"Biotechnology, Pharmaceutical, Therapeutics","Wiltshire, United Kingdom, Europe","GW Pharmaceuticals was founded in 1998 and is listed on both the NASDAQ Global Market (GWPH) and AIM, a market of the London Stock","1,200"
Gelato,https://www.crunchbase.com/organization/gelato-group,"Cloud Computing, Printing, Software","Oslo, Oslo, Norway","Building the world's most intelligent print cloud, delivering end-to-end content and print management to more than 50+ countries worldwide","1,287"
Gram Games,https://www.crunchbase.com/organization/gram-games,Mobile,"Istanbul, Istanbul, Turkey","Gram Games is a venture-backed global mobile game company. Gram is the creator of global hit games 1010!, Six! Merged! & Bounzy!","1,307"
"Gamalon, Inc.",https://www.crunchbase.com/organization/gamalon-inc,"Artificial Intelligence, Enterprise Software, Machine Learning","Cambridge, Massachusetts, United States","Gamalon is a machine intelligence company based in Cambridge, Massachusetts.","1,314"
Gimlet Media,https://www.crunchbase.com/organization/gimlet-media,"Audio, Digital Media, Media and Entertainment, News, Podcast, Social Media, Video","New York, New York, United States",A series about what happens when someone who knows nothing about business starts one. .,"1,353"
GumGum,https://www.crunchbase.com/organization/gumgum,"Advertising, Advertising Platforms, Analytics, Artificial Intelligence, Brand Marketing, Computer Vision, Digital Media, Image Recognition, Sports","Santa Monica, California, United States","GumGum is an artificial intelligence company, with deep expertise in computer vision.","1,385"
Golden State Warriors,https://www.crunchbase.com/organization/golden-state-warriors,Sports,"Oakland, California, United States","The Golden State Warriors are an American professional basketball team based in Oakland, California.","1,419"
Grand Rounds,https://www.crunchbase.com/organization/grand-rounds,"Enterprise Software, Health Care, Health Diagnostics, Medical","San Francisco, California, United States",Grand Rounds helps employers reduce the waste out of their healthcare spend by giving employees access to top quality physicians.,"1,466"
Group Nine Media,https://www.crunchbase.com/organization/group-nine-media,"Digital Entertainment, Digital Media, Media and Entertainment, Video","New York, New York, United States",Group Nine Media is a digital-first media company that boasts nearly 4 billion video views every month.,"1,479"
Good Technology,https://www.crunchbase.com/organization/good-technology,"Analytics, Collaboration, Cyber Security, Enterprise Software, Financial Services, Messaging, Mobile, Security","Sunnyvale, California, United States",Good Technology is a pioneer and world leader in secure mobility solutions for businesses.,"1,489"
Gradescope.,https://www.crunchbase.com/organization/gradescope,"Artificial Intelligence, EdTech, Higher Education, Skill Assessment, Software","Berkeley, California, United States",Gradescope enables instructors to grade paper-based assignments online.,"1,518"
Graphcore,https://www.crunchbase.com/organization/graphcore,"Hardware, Machine Learning, Semiconductor","Bristol, Bristol, City of, United Kingdom",Graphcore server hardware system accelerates the processing of complex machine learning models for training and inference.,"1,527"
Grover,https://www.crunchbase.com/organization/byebuy,"FinTech, Rental, Sharing Economy, Subscription Service, Sustainability","Berlin, Berlin, Germany","Grover is a fresh alternative to owning things, helping people find better ways to live, work and play through easy access to the best tech.","1,540"
gumi,https://www.crunchbase.com/organization/gumi,"Gaming, Information Technology, Mobile, Social Network","Singapore, Central Region, Singapore","gumi is a games development company that offers Gree, a mobile social network based in Japan.","1,558"
Glovo,https://www.crunchbase.com/organization/glovo-app,"Delivery, Local, Mobile, Transportation","Barcelona, Catalonia, Spain",Glovo delivers anything in your city in minutes. Our vision is to make everything in all major cities immediately accesible.,"1,573"
Gainsight,https://www.crunchbase.com/organization/gainsight,"Enterprise Software, SaaS, Social Media, Social Media Marketing","Redwood City, California, United States","Gainsight, the Customer Success company, helps businesses grow faster by reducing churn, increasing upsell, and driving customer advocacy.","1,624"
GroundTruth,https://www.crunchbase.com/organization/xad,"Advertising, Marketing, Mobile, Mobile Apps","New York, New York, United States","GroundTruth, the leading location technology company that drives results with real-world data.","1,643"
GameMine,https://www.crunchbase.com/organization/gamemine,"Emerging Markets, Gaming, Mobile","Los Angeles, California, United States","GameMine Inc. is a US-based mobile game publisher headquartered in Los Angeles, California.","1,742"
Genesys,https://www.crunchbase.com/organization/genesys,"Business Intelligence, Cloud Infrastructure, Contact Management, CRM, Customer Service, Software, Text Analytics","Daly City, California, United States",Genesys is the market leader in omnichannel customer experience (CX) and contact center solutions in the cloud and on-premises.,"1,749"
GoCardless,https://www.crunchbase.com/organization/gocardless,"Financial Services, Internet, Payments","London, England, United Kingdom","GoCardless is a UK-based online direct debit provider that makes collecting payments easy, from individuals to multi-national corporations.","1,760"
Grabr,https://www.crunchbase.com/organization/grabr,"Delivery, E-Commerce, Peer to Peer, Travel","San Francisco, California, United States",Grabr is a global peer-to-peer shopping and delivery platform.,"1,778"
GuardiCore,https://www.crunchbase.com/organization/guardicore,"Data Center, Network Security, Security","Tel Aviv, Tel Aviv, Israel",GuardiCore provides network security solutions for software defined data centers.,"1,798"
GREE,https://www.crunchbase.com/organization/gree,"Internet, Mobile, Social Network","Tokyo, Tokyo, Japan","Gree is a Japanese internet media company that provides mobile social networking, and mobile technology services for its users.","1,843"
Glint,https://www.crunchbase.com/organization/glint,"Enterprise Software, Human Resources, Recruiting","Redwood City, California, United States",Glint offers an employee engagement platform.,"1,851"
Giosis,https://www.crunchbase.com/organization/giosis,"Brand Marketing, E-Commerce, Marketplace","Singapore, Central Region, Singapore","Giosis, also known as Qoo10,  is an online marketplace for Korean audiences.","1,879"
GoSpotCheck,https://www.crunchbase.com/organization/gospotcheck,"Brand Marketing, Enterprise Software, Finance, Market Research, Mobile, Retail","Denver, Colorado, United States",GoSpotCheck develops web and mobile apps that help employees gather real-time retail intelligence information from the field.,"1,921"
Guardian Analytics,https://www.crunchbase.com/organization/guardiananalytics,"Internet, Real Time, Security","Mountain View, California, United States","Guardian Analytics provides real-time omni-channel fraud prevention solutions to protect online, mobile, wire and ACH channels.","1,936"
Global Processing Services,https://www.crunchbase.com/organization/global-processing-services,Financial Services,"Douglas, NA - Isle of Man, Isle of Man",GPS is a global payments processor offering award-winning payment processing and industry-leading technology in payments and fintech.,"1,940"
Genetesis,https://www.crunchbase.com/organization/genetesis,"Health Care, Health Diagnostics, Medical Device","Cincinnati, Ohio, United States","Genetesis has developed CardioFlux, the first tool to non-invasively generate images of the heart’s electrical current distribution.","1,946"
Grow,https://www.crunchbase.com/organization/grow-2,"Analytics, Business Intelligence, SaaS, Software","Orem, Utah, United States",Grow is a Utah-based business intelligence dashboard software for small and medium businesses.,"1,985"
Gong.io,https://www.crunchbase.com/organization/gong-io,"Artificial Intelligence, CRM, Sales, Software","Palo Alto, California, United States","Gong is conversation intelligence software for sales teams that uses AI to record, transcribe, and analyze sales conversations.","2,001"
Gogoro,https://www.crunchbase.com/organization/gogoro,"Automotive, Electric Vehicle, Energy, Energy Efficiency","Taipei, T'ai-pei, Taiwan",Gogoro aims to deliver consumer innovations that will improve how the world’s most populated cities distribute and utilize energy.,"2,009"
Grupo Netshoes,https://www.crunchbase.com/organization/netshoes,"E-Commerce, Fashion, Shopping, Sporting Goods","Brasil, Sao Paulo, Brazil",Netshoes is a Brazilian company selling sporting goods through the internet.,"2,011"
GuideSpark,https://www.crunchbase.com/organization/guidespark,"Enterprise Software, Human Resources, Training","Redwood City, California, United States","GuideSpark, the leader in employee communication with 600 customers, offers solutions to activate employees and drive HR program adoption. ","2,020"
Genoox,https://www.crunchbase.com/organization/genoox,"Cloud Data Services, Genetics, Health Care","Palo Alto, California, United States",Genoox is an innovative platform for managing and storing genomic data in the cloud.,"2,027"
Grove,https://www.crunchbase.com/organization/grove-labs,"Agriculture, Consumer Goods, Home and Garden, Machinery Manufacturing, Organic Food, SaaS","Somerville, Massachusetts, United States","Grove builds products to make local, healthy food accessible to everyone.","2,072"
Greenhouse Software,https://www.crunchbase.com/organization/greenhouse-software,"B2B, Enterprise Software, Recruiting, SaaS, Software","New York, New York, United States",Greenhouse is a recruiting optimization platform to help companies build and scale their recruiting processes.,"2,105"
GLG (Gerson Lehrman Group),https://www.crunchbase.com/organization/gerson-lehrman-group,"EdTech, Information Services, Professional Services","New York, New York, United States",GLG is the world’s leading platform for professional learning.,"2,174"
GoTenna,https://www.crunchbase.com/organization/gotenna,"Consumer Electronics, Hardware, Messaging, Mobile, Privacy, Software","Brooklyn, New York, United States",GoTenna is a new device that pairs with your smartphone and lets you communicate with others even when you don't have service.,"2,211"
G5,https://www.crunchbase.com/organization/g5-search-marketing,"Advertising, Local, Marketing, Property Management, Search Engine","Bend, Oregon, United States",G5 provides digital experience management (DXM) software and services in the property management sector.,"2,239"
G4S,https://www.crunchbase.com/organization/g4s,"Finance, Network Security, Security","London, England, United Kingdom","G4S, an international security solutions group, focuses on BPO sectors where security and safety risks are considered a strategic threat.","2,253"
Gospel Technology,https://www.crunchbase.com/organization/gospel-technology,"Big Data, Cloud Security, Cyber Security, Internet of Things, Software","London, England, United Kingdom","Gospel delivers a secure,  trusted data distribution platform for enterprise based on blockchain technology.","2,255"
Gravie,https://www.crunchbase.com/organization/gravie,"Health Care, Health Insurance, Hospital, Insurance","Minneapolis, Minnesota, United States","Gravie helps consumers choose and buy insurance, pay for it, and manage all health care expenses.","2,270"
GreyOrange,https://www.crunchbase.com/organization/gogreyorange,"Hardware, Industrial Automation, Logistics, Robotics, Software","Singapore, Central Region, Singapore",GreyOrange is 300+ employee technology startup that is creating hardware & software products for warehousing industry.,"2,317"
GoEuro,https://www.crunchbase.com/organization/goeuro,"Business Development, Internet, Search Engine, Travel","Berlin, Berlin, Germany","GoEuro is a multi-mode search tool that compares and combines rail, air, bus, and car for European destinations.","2,327"
Groq,https://www.crunchbase.com/organization/groq,"Electronics, Manufacturing, Semiconductor","Palo Alto, California, United States","Groq is developing the tensor processing unit, which is an integrated circuit developed specifically for machine learning.","2,436"
Gladly Inc,https://www.crunchbase.com/organization/gladly-software,"Computer, Customer Service, Information Technology, Software, Technical Support","San Francisco, California, United States","Gladly is reinventing customer service with a customer service platform that centers around customers, not cases, across any channel.","2,486"
GoZefo,https://www.crunchbase.com/organization/gozefo,"Computer, Furniture, Software","Bangalore, Karnataka, India",Startup working on a white space in the eCommerce industry.,"2,493"
Guardant Health,https://www.crunchbase.com/organization/guardant-health,"Biotechnology, Health Care, Health Diagnostics","Redwood City, California, United States",Guardant Health is committed to positively and significantly impacting patient health through technology breakthroughs in oncology.,"2,525"
"Gazillion, Inc.",https://www.crunchbase.com/organization/gazillion-entertainment,"MMO Games, Mobile, Online Games, Virtual Reality","Foster City, California, United States",Gazillion is a privately held developer and publisher of online and mobile games.,"2,544"
Gigster,https://www.crunchbase.com/organization/gigster,"Apps, Internet, Mobile","San Francisco, California, United States","Gigster provides software development and access to elite teams of developers, designers, and product managers.","2,570"
Gravyty,https://www.crunchbase.com/organization/gravyty,,"Newton, Massachusetts, United States",Gravyty is the future of nonprofit fundraising through artificial intelligence and machine learning.,"2,580"
GPB Capital Holdings,https://www.crunchbase.com/organization/gpb-capital-holdings,"Automotive, Real Estate, Real Estate Investment","New York, New York, United States","GPB Capital is a New York-based investment firm with a focus on acquiring middle-market, income-producing portfolio companies.","2,694"
GoodData,https://www.crunchbase.com/organization/good-data,"Analytics, Business Intelligence, Collaboration, Enterprise Software, SaaS","San Francisco, California, United States","GoodData provides the platform and expertise to drive new sources of revenue with high value, customer-facing analytics.","2,768"
